{
  "schema": "data-assurance-pack/v1",
  "pack_kind": "static_synthetic_reference",
  "synthetic_identity": "assurance-fixture.example.invalid",
  "trust_policy": {
    "policy_identity": "assurance-trust-policy.example.invalid",
    "sha256": "sha256:2bbc70dede950d45dc792792de5bb6ca4e7deaad871c045feb0cfbe19443d411"
  },
  "dataset_version": "sha256:e893c9f6b0afcc57832054547002c826e80b5387e544b4cf6909afc9424dde3a",
  "release": {
    "release_id": "sha256:da1a06c5b11b20fc76afa269c324ab869293cdd67d232cf62f05724dc1fc124a",
    "artifact_index_sha256": "sha256:9964bddf9dbb99cd09f4be234619bf52b1dcc7eeec309f0874b45bc42db0156c",
    "artifacts": [
      { "path": "/api/v1/records.json", "sha256": "sha256:7097b12b5268249373eec40ec73897d34f9f7f4d429a83c21ba44d353f57f550", "bytes": 2722795 },
      { "path": "/data/manifest.json", "sha256": "sha256:4dde60c6d8f255e2b5d0533aa5c4b89372e0ae3cf5fdddebeddabab239c48f29", "bytes": 215953 }
    ]
  },
  "footprint": { "countries": ["SE"], "categories": ["emergency", "general_support"] },
  "coverage": {
    "record_count": 2, "country_count": 1, "category_count": 2, "active_count": 2, "deprecated_count": 0, "replacement_reference_count": 0,
    "independently_accepted_evidence_count": 1, "provider_claims_pending_count": 1, "provider_claims_rejected_count": 0, "unresolved_or_unknown_evidence_count": 0
  },
  "records": [
    {
      "record_id": "weh_7539ec4b00fd54f5ae729d71", "country": "SE", "category": "general_support", "lifecycle": "active", "replacement_record_id": null,
      "evidence_summary": { "independently_accepted": 0, "provider_claims_pending": 1, "provider_claims_rejected": 0, "unresolved_or_unknown": 0 }, "uncertainty": "unresolved"
    },
    {
      "record_id": "weh_c3f7a20baee453f8ba87d0d3", "country": "SE", "category": "emergency", "lifecycle": "active", "replacement_record_id": null,
      "evidence_summary": { "independently_accepted": 1, "provider_claims_pending": 0, "provider_claims_rejected": 0, "unresolved_or_unknown": 0 }, "uncertainty": "independently_reviewed"
    }
  ],
  "limitations": [
    "Static synthetic contract evidence only; not a customer or provider export.",
    "No raw crisis usage, live availability, quality, ranking, outcome, uptime, support, or SLA claim.",
    "Provider claims are untrusted input and cannot verify, rank, publish, or mutate canonical records."
  ]
}
